{
  "rules_version": "v1.0.0",
  "aliases": {
    "@status": [
      "outcome",
      "status",
      "result"
    ],
    "@latency": [
      "latency_ms",
      "duration_ms",
      "ttft_ms"
    ],
    "@errorCode": [
      "http_status",
      "error.code",
      "response.status"
    ]
  },
  "default_action": {
    "level": "info",
    "category": "core_api",
    "outcome": "success",
    "tags": []
  },
  "rules": [
    {
      "rule_id": "api-startup-guard",
      "version": "1.0.0",
      "name": "Filter startup events (noise guard)",
      "description": "Suppress startup event logging as non-interaction noise",
      "applies_to": [
        "core_api"
      ],
      "when": {
        "all": [
          {
            "field": "event_type",
            "op": "eq",
            "value": "startup"
          }
        ]
      },
      "then": {
        "level": "info",
        "category": "core_api",
        "sub_category": "system",
        "outcome": "success",
        "tags": [
          "core_api",
          "startup",
          "guard"
        ]
      }
    },
    {
      "rule_id": "api-build-guard",
      "version": "1.0.0",
      "name": "Filter build events (noise guard)",
      "description": "Suppress build event logging as non-interaction noise",
      "applies_to": [
        "core_api"
      ],
      "when": {
        "all": [
          {
            "field": "event_type",
            "op": "eq",
            "value": "build"
          }
        ]
      },
      "then": {
        "level": "info",
        "category": "core_api",
        "sub_category": "build",
        "outcome": "success",
        "tags": [
          "core_api",
          "build",
          "guard"
        ]
      }
    },
    {
      "rule_id": "api-health-check-guard",
      "version": "1.0.0",
      "name": "Filter health check events (noise guard)",
      "description": "Suppress health check logging as non-interaction noise",
      "applies_to": [
        "core_api"
      ],
      "when": {
        "all": [
          {
            "field": "event_type",
            "op": "eq",
            "value": "health_check"
          }
        ]
      },
      "then": {
        "level": "info",
        "category": "core_api",
        "sub_category": "service",
        "outcome": "success",
        "tags": [
          "core_api",
          "health",
          "guard"
        ]
      }
    },
    {
      "rule_id": "api-5xx-critical",
      "version": "1.0.0",
      "name": "Critical 5xx server errors",
      "description": "Classify 5xx HTTP errors as critical service failures",
      "applies_to": [
        "core_api"
      ],
      "when": {
        "all": [
          {
            "field": "@errorCode",
            "op": "gte",
            "value": 500
          },
          {
            "field": "@errorCode",
            "op": "lt",
            "value": 600
          }
        ]
      },
      "then": {
        "level": "critical",
        "category": "core_api",
        "sub_category": "service",
        "outcome": "failure",
        "tags": [
          "core_api",
          "5xx"
        ]
      }
    },
    {
      "rule_id": "api-4xx-client-error",
      "version": "1.0.0",
      "name": "Client 4xx errors",
      "description": "Flag client errors (400-499) as warnings",
      "applies_to": [
        "core_api"
      ],
      "when": {
        "all": [
          {
            "field": "@errorCode",
            "op": "gte",
            "value": 400
          },
          {
            "field": "@errorCode",
            "op": "lt",
            "value": 500
          }
        ]
      },
      "then": {
        "level": "warn",
        "category": "core_api",
        "sub_category": "user_input",
        "outcome": "failure",
        "tags": [
          "core_api",
          "4xx"
        ]
      }
    },
    {
      "rule_id": "api-unauthorized",
      "version": "1.0.0",
      "name": "Authentication failures",
      "description": "Flag 401/403 unauthorized access attempts",
      "applies_to": [
        "core_api"
      ],
      "when": {
        "any": [
          {
            "field": "@errorCode",
            "op": "eq",
            "value": 401
          },
          {
            "field": "@errorCode",
            "op": "eq",
            "value": 403
          }
        ]
      },
      "then": {
        "level": "warn",
        "category": "core_api",
        "sub_category": "auth",
        "outcome": "failure",
        "tags": [
          "core_api",
          "auth"
        ]
      }
    },
    {
      "rule_id": "api-conflict-error",
      "version": "1.0.0",
      "name": "Resource conflict or version mismatch",
      "description": "Flag 409 conflicts as data consistency warnings",
      "applies_to": [
        "core_api"
      ],
      "when": {
        "all": [
          {
            "field": "@errorCode",
            "op": "eq",
            "value": 409
          }
        ]
      },
      "then": {
        "level": "warn",
        "category": "core_api",
        "sub_category": "data",
        "outcome": "failure",
        "tags": [
          "core_api",
          "conflict"
        ]
      }
    },
    {
      "rule_id": "api-high-latency",
      "version": "1.0.0",
      "name": "High latency response (>2s)",
      "description": "Flag responses slower than 2000ms",
      "applies_to": [
        "core_api"
      ],
      "when": {
        "all": [
          {
            "field": "@latency",
            "op": "gte",
            "value": 2000
          },
          {
            "field": "@status",
            "op": "eq",
            "value": "success"
          }
        ]
      },
      "then": {
        "level": "warn",
        "category": "core_api",
        "sub_category": "service",
        "outcome": "success",
        "tags": [
          "core_api",
          "latency"
        ]
      }
    },
    {
      "rule_id": "api-timeout-failure",
      "version": "1.0.0",
      "name": "Request timeout error",
      "description": "Flag timeout failures with high latency thresholds",
      "applies_to": [
        "core_api"
      ],
      "when": {
        "all": [
          {
            "field": "@status",
            "op": "eq",
            "value": "timeout"
          }
        ]
      },
      "then": {
        "level": "error",
        "category": "core_api",
        "sub_category": "network",
        "outcome": "timeout",
        "tags": [
          "core_api",
          "timeout"
        ]
      }
    },
    {
      "rule_id": "api-security-violation",
      "version": "1.0.0",
      "name": "Security or PII detected",
      "description": "Flag events with security or PII safety flags",
      "applies_to": [
        "core_api"
      ],
      "when": {
        "any": [
          {
            "field": "safety_flags",
            "op": "contains",
            "value": "flag_security"
          },
          {
            "field": "safety_flags",
            "op": "contains",
            "value": "flag_pii"
          }
        ]
      },
      "then": {
        "level": "critical",
        "category": "core_api",
        "sub_category": "security",
        "outcome": "failure",
        "tags": [
          "core_api",
          "security"
        ]
      }
    },
    {
      "rule_id": "core-api-error-rate-high",
      "version": "1.0.0",
      "name": "High error rate detected",
      "description": "Extract % from raw message and flag if >= 10%",
      "applies_to": [
        "core_api"
      ],
      "when": {
        "all": [
          {
            "field": "meta.raw_message",
            "op": "extract_percent",
            "pattern": "([0-9]+)\\s*%",
            "compare": {
              "gte": 10
            }
          }
        ]
      },
      "then": {
        "level": "warn",
        "category": "core_api",
        "sub_category": "metrics",
        "outcome": "failure",
        "tags": [
          "core_api",
          "error_rate"
        ]
      }
    },
    {
      "rule_id": "llm-quant-error",
      "version": "1.0.0",
      "name": "Model quantization errors",
      "description": "Flag quantization failures during model loading",
      "applies_to": [
        "llm"
      ],
      "when": {
        "all": [
          {
            "field": "pipeline_stage",
            "op": "eq",
            "value": "quant"
          },
          {
            "field": "outcome",
            "op": "eq",
            "value": "failure"
          }
        ]
      },
      "then": {
        "level": "error",
        "category": "llm",
        "sub_category": "quantization",
        "outcome": "failure",
        "tags": [
          "llm",
          "quant"
        ]
      }
    },
    {
      "rule_id": "llm-model-load-failure",
      "version": "1.0.0",
      "name": "Model loading errors",
      "description": "Flag failures during model load stage",
      "applies_to": [
        "llm"
      ],
      "when": {
        "all": [
          {
            "field": "pipeline_stage",
            "op": "eq",
            "value": "load"
          },
          {
            "field": "outcome",
            "op": "eq",
            "value": "failure"
          }
        ]
      },
      "then": {
        "level": "critical",
        "category": "llm",
        "sub_category": "model_load",
        "outcome": "failure",
        "tags": [
          "llm",
          "model_load"
        ]
      }
    },
    {
      "rule_id": "llm-safety-flag-critical",
      "version": "1.0.0",
      "name": "LLM safety violations",
      "description": "Flag events with safety or policy violations",
      "applies_to": [
        "llm"
      ],
      "when": {
        "any": [
          {
            "field": "safety_flags",
            "op": "contains",
            "value": "flag_security"
          },
          {
            "field": "safety_flags",
            "op": "contains",
            "value": "policy_violation"